{
  "schema_version": "1.0.0",
  "as_of": "2024-04-22T22:00:00Z",
  "replay_mode": "system",
  "instrument": "XAUUSD",
  "timeframe": "1d",
  "synthetic": true,
  "price_status": "fresh",
  "technical": {
    "bars_available": 80,
    "close": 1169.754,
    "sma_20": 1135.416455,
    "sma_50": 1108.930404,
    "momentum_20": 0.03493297134322648,
    "atr_14_sma": 13.56562857142855,
    "realized_volatility_20_per_bar": 0.0025897924210528645,
    "trend": "up",
    "breakout_20": "inside",
    "confirmed_swing_structure": "unknown",
    "prior_20_high": 1170.0831,
    "prior_20_low": 1116.0485
  },
  "context": {
    "macro": {
      "status": "missing",
      "observations": []
    },
    "central_banks": {
      "status": "missing",
      "observations": []
    },
    "etf": {
      "status": "missing",
      "observations": []
    },
    "physical": {
      "status": "missing",
      "observations": []
    },
    "options": {
      "status": "missing",
      "observations": []
    },
    "positioning": {
      "status": "missing",
      "observations": []
    },
    "news": {
      "status": "missing",
      "observations": []
    },
    "calendar": {
      "status": "missing",
      "observations": []
    }
  },
  "warnings": [
    "SYNTHETIC DEMONSTRATION: not actual market observations.",
    "Context ages are reported; no universal macro freshness or causal bias is inferred."
  ],
  "evidence_ids": [
    "01cf4541655c7fa5437b671b0fc8eb48ac5212d5b72f59a26a844885bc27e7bb",
    "05e341e18da7551cf1acf42fb46fbae7ea384f2a1aa7e04ba500bbd249f1a2d7",
    "0b3d6a4bee489c3b2c5dc1fcae0e9df304dc0736940b26802f9939f53c1b1a4c",
    "0e074ccc3359fe4f03848958517cf336014718d0873b972a5f6d52618f663fb7",
    "0e886dba9faa31449efb39fc0d38a1c8d7d492a4d0113754dbdcd65ea6ee9947",
    "0f79143ef41881e6926b255732e1f9d4cb9b74c7fcd2c28ff819c4b07de88b34",
    "108a9690533596c993ea70ed3ad497cfbb581a471007cb8df8f957320509fe05",
    "1b0f497c19ecc32022b16f387766b8883ed97ebd67ad91ed66bc5221dbcb6fe5",
    "1b94424cc23db2541ac82640d71371613f30a7047a032a8c000a55a20c6a09ad",
    "23ded9d1f4a8ef819d7f6437afdca36b4c34c416a9416a67610ff7189cf986be",
    "289a942a269ec1f67c484c561c8469a2ec4618798acee7555ff56cbfcf5015a8",
    "2d08f7ffef78c4dd44d7abd31d65c54d9f93c7840ae7b9af8f4d22ea7fc0d0f4",
    "2d8b5132a105ae754762126599da8bbaedf6d7c63e2b18988188eaeea42179e2",
    "2ef4af0179cad61a7bb43b8bd36293f45e015b5ca67a480924182c9c5d186047",
    "3057e99b325b918f407896e11d48e4397baeda52de0d3cc0ed6bb2ba6fc686ec",
    "31ebc63b041bed5464698ac7bf19331131c5da738b222102a3b45b245a322293",
    "35dc616d89113b846c91c70eaa2d9dd1ebcf6ed0117f06acf66751db4d0430b0",
    "399b511e6efa4f0dcb0d03682dbc18236dea527c60078666618d5c2f548007b3",
    "3c6fc5ce644b752888ac3aafef6ad2a38234337b333494251d8c7e5417190084",
    "421f427940f0f40a98aefc206d4b00e426f60e999b4825114b9fb95714c3d6ea",
    "4780f4aa11da312d2f1760174ed5bde7004f9ba56910b5bb82fab86c94bac237",
    "4b391c02e2023ac3361438d8804039573b9d005d3a11cbad3fbdd4c45cc2c511",
    "4b9ad2e5cd17cb1a2bebef1ba7b69c719b4eb0d4e09bb9fab10960330e7a6ae6",
    "4bb02c621aac247721a99b582096e17bc88e6c11aa49e9907fd2d7f594e912dd",
    "4d0da5db1d67641c2318b88019788c268fcbf9474eb31bdb9f5265327d3014d4",
    "5498a689cb8333ff4fda35b655faa938bd4c842605f9dcdbac5cf6d8006e5da9",
    "569ee7a0aec259f440c5d406ac277c7561ce05e3146c6387ec83afc11f22cf4f",
    "57040d530026437779b4f55f6889a78c731011c0994541dfd5725ccb272f33cf",
    "5eb3f7358711350778253cd08e4affaf854cca322d4004fa3749c57a486cf0bb",
    "6122be23abe35692a29940381bca19709f5967c94ffb389c07c95751183248ef",
    "62a1a079d9676bc016d1e54ae08978a193b4a3c36f345fac1d0194081eaaf26f",
    "640e956c04710a6bf45d67c81eeec2539759923d82f98040358a3cdd5dd368a5",
    "65091a299059efd223165d6a6c67b0291099b628ede6d0c3620e4a3a596aa338",
    "69c8db9935d5e10b7d10235075a0a59fc04c73cd51f4458520b63116b632cd3d",
    "741e78280dd7d38f4d147683e9e8e778822b23e4d2b030df37ad0f8f31eed48b",
    "835c7f53b0619f8b6bcdc361c619d05577def7d08fb968750beeeb5d0bffcdf7",
    "837709c0dc89b5b08622161bcd211a8c9effefc176c988850db3e1ee4f8e7177",
    "83fbaea0c47ea4c8bfefd5560b13e2a3aa7406f205d9e5693fde2aac028d8bfc",
    "8456b93d6748995464accce26868352b2b985ce1e74d806e360d2de369dd892c",
    "878dffa7fae96cd160fb57bfbcdbab3514da842aaa88082325981f3507d26337",
    "8c1746178aa1ba85307ef14d9c8eaa432ffaaf3013285dec3dfce31a3d9c9278",
    "8ee4d74aa8d69b31ef348f8e1442846a0fa82477e23b103f6dff9a16107b9a2d",
    "8f23dd39c320184e680b0579276a80ee21d96cc5d1be950022859f53ec164cec",
    "9112a94ccaa646b651418c0610f3d1db9faab29155763b027c393e2d299b62fd",
    "91d203ab3e2acf1f261a46f92c58cd1655097ac88b11710376ecad657bc20790",
    "91dd3cac75d2c284d03bd8e6989f8eae08653af1b9a05881358f74f7a75a9c53",
    "91ff0b52123f422c8376e3513cf0e55402015273ea16ae956e4b2436849351a3",
    "978d1e9eb09286ee431604b9da3c81d860ea866e9b4544e3fee24329c4881c53",
    "97d8dc2851ac7ea75214d424a8f59a90218580bee60ffcfd9f5ffd1ec835142d",
    "99c44fb875061541296f91f35afdc2d642ecb838339cc3d93abbe0fd0984d323",
    "9c9dc1294e71ea128e875ba24c389463db5529e9d8547b02cb993fe0fe1bbe0d",
    "9d268951b913b7b687e8552f3b41effdd66c15b21c82e88fc487e9be3d192bb5",
    "9fca85de37aa65590c2bb2d04cdd70a4135303c972a5fcf7649f4ce7548860e9",
    "a00a35fd26cc8ab7d73f3992a78fe32657fdc3f7c0475913447d3e25ae17dd12",
    "aaae30ddeb96524f0ae2fb2ca6c337aa5fd53e4ee92eb025a2ba1de974fb25f3",
    "ac36812aad3b1aba0df7fdbf95cec1988f538752e65054f1558579e130c43056",
    "ac730a22531323a10f34bbfa66e1092d00b1b26bbaabc9423bd3cd683b9a31f0",
    "af3a2c4cdfb1a3f4fccf2c8610b47607a1b08123de34643fbfe3b5bf370a9dce",
    "affc48fb43488a94699cf1cdedfe5330af12a83b95e9f8e4b7a261e39b0b37a1",
    "b72d11cba446351582ae486aed101f9186b7d59a3eeeda549db7c3147294fe1f",
    "b9a365a1b71a88ba1672085aef3c1c5db4f82f23e8e3a45f6b5e6762922ee358",
    "bd319da715f70b09f114a1d65fa0700cc35396249b942e978237090b8b3a9795",
    "bfa98862c08902035f8f4a0e91b61c19481526975b1addc00fcd236e36ca257d",
    "c05c74b5b31d8529a9d4c59ea55f30d6ed7871c82729cc392a32fa98da3750a6",
    "c0ba4d34506983e127e7006f2f0d1278dad071fc1d02f34c6c3b2c696a869152",
    "c207ccfaf194cd509e1ad6f2d88793c5728c7c15cc8f1d2fa7bdff34767efea8",
    "c3f94edabcfaa4e52f16dd34c303bdf8d59bb0681a3adbf32f2cf4319cc8c1f6",
    "c5782ed43c404d2ced80fea1e4ee86f49d59ad01f3d8b6ce98f263f6a51be4f2",
    "c60b92e2d9490b5fa4e366220e80cc6c3863b1dff48addc138e1e26b0d2c9560",
    "cd9e3ba75dd4d0d21689fcaffa1f402651483d97682c24fc3b60866b4bb72ed3",
    "d1ff8e7c57c2c8ea658fdfec315cad1a29abd7bb7111ef4aa75e25377632e75c",
    "d38c2294f971bce685b357c539673090896a600c08701229aeca26aeea6e8c40",
    "da3b75a9540d9eea61b223a88357faef9c46b451be1d82a29c80d6580821703e",
    "dbc81c2922c1acfdf28348868b819a67d798e7c872360f340e148ccb42553e3c",
    "dbf6a68058aabcc4704656493649b16925f8f18fae66fe4c217dc25dca53b451",
    "e1b75672d45c5d4e8f934d006a71592d37642b54ea8144e07f73f85016802e90",
    "e83a7e8117c99bb530f402fce8cc7c798c9af65dc42270e3381e207370ac5996",
    "ea2c9908de5f742444db3cb8b500106566db23dadcf6421cd67e647767cfa154",
    "ea4bec17a5038beafa98dd9c3165edebe479a1302d65c19f49b7b15973da2c9c",
    "ff316a224af56b5790c97b0d4df40ad149956419b75ecb16bffc4b58846cf313"
  ],
  "feature_version": "technical_v1",
  "analysis_scope": "research_only",
  "decision": "NO_TRADE",
  "decision_reason": "No validated trading strategy or execution adapter is installed.",
  "parameters": {
    "stale_after_hours": 96,
    "source_id": "synthetic_demo",
    "dataset": "fictional_daily_v1",
    "venue": "SYNTHETIC",
    "currency": "USD",
    "unit": "currency_per_troy_ounce"
  }
}
